{
  "schema_version": "0.5",
  "spec_version": "0.0.0-corpus",
  "target_url": "https://example.com/",
  "mcp_endpoint": null,
  "mcp_discovery": [
    {
      "source": "/.well-known/mcp.json",
      "status": 404
    },
    {
      "source": "/.well-known/mcp/server-card.json",
      "document": "server-card",
      "status": 200,
      "shape": "sep-1649",
      "endpoint": "https://mcp.example.net/mcp",
      "blocked": "off-origin endpoint declaration"
    },
    {
      "source": "/.well-known/ai-catalog.json",
      "document": "ai-catalog",
      "status": 404
    },
    {
      "source": "/.well-known/api-catalog",
      "document": "api-catalog",
      "status": 404
    },
    {
      "source": "/mcp",
      "status": 404,
      "probed": "initialize (no serverInfo)"
    },
    {
      "source": "/sse",
      "status": 404,
      "probed": "initialize (no serverInfo)"
    },
    {
      "source": "/message",
      "status": 404,
      "probed": "initialize (no serverInfo)"
    },
    {
      "source": "/mcp",
      "status": 404,
      "probed": "modern-tools-list (no tools)"
    },
    {
      "source": "/sse",
      "status": 404,
      "probed": "modern-tools-list (no tools)"
    },
    {
      "source": "/message",
      "status": 404,
      "probed": "modern-tools-list (no tools)"
    }
  ],
  "tool": {
    "name": "example.com",
    "url": "https://example.com/"
  },
  "audience": null,
  "audit_profile": null,
  "site_type": null,
  "public_listing": false,
  "vantage": {
    "network": "public",
    "credentialed": false
  },
  "follow_declarations": true,
  "declared_hosts": [
    {
      "surface": "/.well-known/mcp/server-card.json",
      "kind": "mcp-endpoint",
      "url": "https://mcp.example.net/mcp",
      "host": "mcp.example.net",
      "outcome": "reciprocity-refused"
    }
  ],
  "summary": {
    "pass": 9,
    "noncompliant": 0,
    "broken": 1,
    "absent": 7,
    "n_a": 50,
    "skip": 0,
    "error": 1
  },
  "coverage_summary": {
    "must": {
      "total": 1,
      "verified": 0
    },
    "should": {
      "total": 13,
      "verified": 6
    },
    "may": {
      "total": 3,
      "verified": 3
    }
  },
  "score_pct": 49,
  "score": {
    "relative": 49,
    "global": 12
  },
  "categories": [
    {
      "id": "discoverability",
      "name": "Discoverability",
      "passed": 2,
      "counted": 5
    },
    {
      "id": "content-for-agents",
      "name": "Content for agents",
      "passed": 5,
      "counted": 7
    },
    {
      "id": "bot-crawl-policy",
      "name": "Bot & crawl policy",
      "passed": 1,
      "counted": 1
    },
    {
      "id": "api",
      "name": "API",
      "passed": 0,
      "counted": 3
    },
    {
      "id": "mcp",
      "name": "MCP",
      "passed": 1,
      "counted": 1
    },
    {
      "id": "agent-discovery-auth",
      "name": "Agent discovery & auth",
      "passed": 0,
      "counted": 0
    }
  ],
  "results": [
    {
      "id": "openapi",
      "label": "An OpenAPI description is published",
      "category": "api",
      "group": "P2",
      "layer": "web",
      "keyword": "must",
      "tier": "required",
      "principle": "P2",
      "status": "absent",
      "evidence": "https://example.com/openapi.json -> 404 (status 404 not in [200])",
      "hosts": [
        {
          "host": "example.com"
        }
      ],
      "host": "example.com"
    },
    {
      "id": "json-schemas",
      "label": "Referenced JSON Schemas resolve as application/schema+json",
      "category": "api",
      "group": "P2",
      "layer": "web",
      "keyword": "may",
      "tier": "optional",
      "principle": "P2",
      "status": "n_a",
      "na_reason": "antecedent-unmet",
      "evidence": "no JSON Schema references detected",
      "hosts": []
    },
    {
      "id": "api-catalog",
      "label": "/.well-known/api-catalog published (RFC 9727)",
      "category": "api",
      "group": "P8",
      "layer": "web",
      "keyword": "may",
      "tier": "optional",
      "principle": "P8",
      "status": "n_a",
      "na_reason": "optional-absent",
      "evidence": "https://example.com/.well-known/api-catalog -> 404 (status 404 not in [200])",
      "hosts": [
        {
          "host": "example.com"
        }
      ],
      "host": "example.com"
    },
    {
      "id": "json-errors",
      "label": "API client errors return JSON, not HTML",
      "category": "api",
      "group": "P4",
      "layer": "web",
      "keyword": "should",
      "tier": "recommended",
      "principle": "P4",
      "status": "broken",
      "evidence": "https://example.com/anc-web-audit-no-such-api -> 404 (HTML error body)",
      "hosts": [
        {
          "host": "example.com"
        }
      ],
      "host": "example.com"
    },
    {
      "id": "rate-limit-headers",
      "label": "API responses advertise rate-limit headers",
      "category": "api",
      "group": "P6",
      "layer": "web",
      "keyword": "should",
      "tier": "recommended",
      "principle": "P6",
      "status": "absent",
      "evidence": "https://example.com/anc-web-audit-no-such-api -> 404 (no rate-limit header)",
      "hosts": [
        {
          "host": "example.com"
        }
      ],
      "host": "example.com"
    },
    {
      "id": "mcp-initialize",
      "label": "initialize handshake returns serverInfo + protocolVersion",
      "category": "mcp",
      "group": "P2",
      "layer": "web",
      "keyword": "must",
      "tier": "required",
      "principle": "P2",
      "status": "n_a",
      "na_reason": "reciprocity-refused",
      "evidence": "https://mcp.example.net/mcp",
      "hosts": [
        {
          "host": "mcp.example.net"
        }
      ],
      "host": "mcp.example.net"
    },
    {
      "id": "mcp-capabilities",
      "label": "initialize advertises capabilities (tools / resources / prompts)",
      "category": "mcp",
      "group": "P2",
      "layer": "web",
      "keyword": "should",
      "tier": "recommended",
      "principle": "P2",
      "status": "n_a",
      "na_reason": "reciprocity-refused",
      "evidence": "https://mcp.example.net/mcp",
      "hosts": [
        {
          "host": "mcp.example.net"
        }
      ],
      "host": "mcp.example.net"
    },
    {
      "id": "mcp-tools-list",
      "label": "tools/list returns a tools array with input schemas",
      "category": "mcp",
      "group": "P2",
      "layer": "web",
      "keyword": "must",
      "tier": "required",
      "principle": "P2",
      "status": "n_a",
      "na_reason": "reciprocity-refused",
      "evidence": "https://mcp.example.net/mcp",
      "hosts": [
        {
          "host": "mcp.example.net"
        }
      ],
      "host": "mcp.example.net"
    },
    {
      "id": "mcp-resources-list",
      "label": "resources/list returns at least one resource when advertised",
      "category": "mcp",
      "group": "P2",
      "layer": "web",
      "keyword": "should",
      "tier": "recommended",
      "principle": "P2",
      "status": "n_a",
      "na_reason": "reciprocity-refused",
      "evidence": "https://mcp.example.net/mcp",
      "hosts": [
        {
          "host": "mcp.example.net"
        }
      ],
      "host": "mcp.example.net"
    },
    {
      "id": "mcp-modern-tools-list",
      "label": "header-routed tools/list (2026-07-28) returns tools without initialize",
      "category": "mcp",
      "group": "P2",
      "layer": "web",
      "keyword": "must",
      "tier": "required",
      "principle": "P2",
      "status": "n_a",
      "na_reason": "reciprocity-refused",
      "evidence": "https://mcp.example.net/mcp",
      "hosts": [
        {
          "host": "mcp.example.net"
        }
      ],
      "host": "mcp.example.net"
    },
    {
      "id": "mcp-server-discover",
      "label": "server/discover answers with server identity on the modern lane",
      "category": "mcp",
      "group": "P2",
      "layer": "web",
      "keyword": "should",
      "tier": "recommended",
      "principle": "P2",
      "status": "n_a",
      "na_reason": "reciprocity-refused",
      "evidence": "https://mcp.example.net/mcp",
      "hosts": [
        {
          "host": "mcp.example.net"
        }
      ],
      "host": "mcp.example.net"
    },
    {
      "id": "mcp-unknown-method",
      "label": "unknown JSON-RPC method returns -32601",
      "category": "mcp",
      "group": "P4",
      "layer": "web",
      "keyword": "should",
      "tier": "recommended",
      "principle": "P4",
      "status": "n_a",
      "na_reason": "reciprocity-refused",
      "evidence": "https://mcp.example.net/mcp",
      "hosts": [
        {
          "host": "mcp.example.net"
        }
      ],
      "host": "mcp.example.net"
    },
    {
      "id": "mcp-malformed-body",
      "label": "a non-JSON body draws -32700 (or a typed HTTP 400/415 refusal)",
      "category": "mcp",
      "group": "P4",
      "layer": "web",
      "keyword": "should",
      "tier": "recommended",
      "principle": "P4",
      "status": "n_a",
      "na_reason": "reciprocity-refused",
      "evidence": "https://mcp.example.net/mcp",
      "hosts": [
        {
          "host": "mcp.example.net"
        }
      ],
      "host": "mcp.example.net"
    },
    {
      "id": "mcp-batch-reject",
      "label": "a batch carrying a modern-envelope request is rejected -32600",
      "category": "mcp",
      "group": "P4",
      "layer": "web",
      "keyword": "should",
      "tier": "recommended",
      "principle": "P4",
      "status": "n_a",
      "na_reason": "reciprocity-refused",
      "evidence": "https://mcp.example.net/mcp",
      "hosts": [
        {
          "host": "mcp.example.net"
        }
      ],
      "host": "mcp.example.net"
    },
    {
      "id": "mcp-unknown-tool",
      "label": "tools/call with an unknown tool name returns -32602",
      "category": "mcp",
      "group": "P4",
      "layer": "web",
      "keyword": "should",
      "tier": "recommended",